{
  "schemaVersion": "1.0.0",
  "prefabId": 947,
  "slug": "Junk_01_single_planks",
  "resourceName": "Prefabs/Props/Garbage/Generic/Junk_01/Junk_01_single_planks.et",
  "kind": "prop",
  "blocks": true,
  "canopy": false,
  "localBounds": {
    "min": [
      -1.141901969909668,
      -0.00539889931678772,
      -2.254875898361206
    ],
    "max": [
      1.0413380861282349,
      0.27988719940185547,
      2.4617111682891846
    ]
  },
  "shellBvh": "blas/Junk_01_planks.bvh",
  "instances": [
    {
      "id": "Junk_01_single_planks",
      "kind": "prop",
      "prefab": "Prefabs/Props/Garbage/Generic/Junk_01/Junk_01_single_planks.et",
      "blas": "blas/Junk_01_planks.bvh",
      "xob": "Assets/Props/Garbage/Generic/Junk_01/Junk_01_planks.xob",
      "local": {
        "pos": [
          0.0,
          0.0,
          0.0
        ],
        "quat": [
          0.0,
          0.0,
          0.0,
          1.0
        ],
        "scale": 1.0
      },
      "cover": "none",
      "source": "prefabCoords"
    }
  ]
}
