{
  "schemaVersion": "1.0.0",
  "prefabId": 1280,
  "slug": "TrackSign_01_Curve_Small_rectangle_blue",
  "resourceName": "Prefabs/Structures/Signs/Tourist/TrackSign_01/TrackSign_01_Curve_Small_rectangle_blue.et",
  "kind": "prop",
  "blocks": false,
  "reason": "no-coll",
  "canopy": false,
  "shellBvh": "",
  "instances": []
}
