{
  "schemaVersion": "1.0.0",
  "prefabId": 783,
  "slug": "TransmitterTower_01_medium",
  "resourceName": "Prefabs/Structures/Infrastructure/Towers/TransmitterTower_01/TransmitterTower_01_medium.et",
  "kind": "building",
  "blocks": true,
  "canopy": false,
  "localBounds": {
    "min": [
      -2.3215182987451555,
      37.54624523305893,
      1.1155827964101919
    ],
    "max": [
      -1.980086293578148,
      38.20666220122576,
      1.7372957939659246
    ]
  },
  "shellBvh": "",
  "instances": [
    {
      "id": "5E0EE6177E8B513A",
      "kind": "prop",
      "prefab": "Prefabs/Structures/BuildingParts/Eletrical/HazardBeacon_01/HazardBeacon_Holder_01.et",
      "blas": "blas/HazardBeacon_Holder_01.bvh",
      "xob": "Assets/Structures/BuildingsParts/Electrical/HazardBeacon_01/HazardBeacon_Holder_01.xob",
      "local": {
        "pos": [
          -2.156,
          38.154,
          1.322
        ],
        "quat": [
          0.0,
          -0.7071067811865475,
          0.0,
          0.7071067811865476
        ],
        "scale": 1.0
      },
      "cover": "none",
      "source": "prefabCoords"
    }
  ],
  "notes": [
    "5E0EE6177E8B513A/5E0670C4B6BF785A: Assets/Structures/BuildingsParts/Electrical/HazardBeacon_01/HazardBeacon_01.xob has no collision chunk — no BLAS, no instance",
    "5E0EE6177E8B513A/5E0670C4B6BF785A/5A0882CA93C16A09: Prefabs/Structures/BuildingParts/Eletrical/HazardBeacon_01/HazardBeacon_01_light.et has no mesh"
  ]
}
