{
  "schemaVersion": "1.0.0",
  "prefabId": 925,
  "slug": "SignDirection_Eden_05_4",
  "resourceName": "Prefabs/Structures/Signs/Directions/SignDirection_Eden_01/SignDirection_Eden_05_4.et",
  "kind": "prop",
  "blocks": true,
  "canopy": false,
  "localBounds": {
    "min": [
      -0.7527288794517517,
      -0.5051910281181335,
      -0.03696143627166748
    ],
    "max": [
      0.7370418906211853,
      2.5529487133026123,
      0.060923781245946884
    ]
  },
  "shellBvh": "blas/SignDirection_Eden_05_4.bvh",
  "instances": [
    {
      "id": "SignDirection_Eden_05_4",
      "kind": "prop",
      "prefab": "Prefabs/Structures/Signs/Directions/SignDirection_Eden_01/SignDirection_Eden_05_4.et",
      "blas": "blas/SignDirection_Eden_05_4.bvh",
      "xob": "Assets/Structures/Signs/Directions/SignDirection_Eden_05_4.xob",
      "local": {
        "pos": [
          0.0,
          0.0,
          0.0
        ],
        "quat": [
          0.0,
          0.0,
          0.0,
          1.0
        ],
        "scale": 1.0
      },
      "cover": "none",
      "source": "prefabCoords"
    }
  ]
}
