{
  "schemaVersion": "1.0.0",
  "prefabId": 932,
  "slug": "Workbench_01",
  "resourceName": "Prefabs/Props/Industrial/Workbench_01.et",
  "kind": "prop",
  "blocks": true,
  "canopy": false,
  "localBounds": {
    "min": [
      -1.3006140366196632,
      1.7881393432617188e-7,
      -1.6960860192775726
    ],
    "max": [
      1.3075860366225243,
      1.1941381692886353,
      0.7195140421390533
    ]
  },
  "shellBvh": "blas/Workbench_01.bvh",
  "instances": [
    {
      "id": "Workbench_01",
      "kind": "furniture",
      "prefab": "Prefabs/Props/Industrial/Workbench_01.et",
      "blas": "blas/Workbench_01.bvh",
      "xob": "Assets/Props/Industrial/Workbench_01/Workbench_01.xob",
      "local": {
        "pos": [
          0.0,
          0.0,
          0.0
        ],
        "quat": [
          0.0,
          0.0,
          0.0,
          1.0
        ],
        "scale": 1.0
      },
      "cover": "low",
      "source": "prefabCoords"
    }
  ]
}
