{
  "schemaVersion": "1.0.0",
  "prefabId": 682,
  "slug": "Castle_01_InnerWall_01",
  "resourceName": "Prefabs/Structures/Cultural/Castles/Castle_01_InnerWall_01.et",
  "kind": "building",
  "blocks": true,
  "canopy": false,
  "localBounds": {
    "min": [
      -0.09936666488647461,
      -4.9855852127075195,
      -0.06442290544509888
    ],
    "max": [
      15.842306137084961,
      9.251728057861328,
      2.1499900817871094
    ]
  },
  "shellBvh": "blas/Castle_01_InnerWall_01.bvh",
  "instances": [
    {
      "id": "Castle_01_InnerWall_01",
      "kind": "shell",
      "prefab": "Prefabs/Structures/Cultural/Castles/Castle_01_InnerWall_01.et",
      "blas": "blas/Castle_01_InnerWall_01.bvh",
      "xob": "Assets/Structures/Cultural/Castles/Castle_01/Castle_01_InnerWall_01.xob",
      "local": {
        "pos": [
          0.0,
          0.0,
          0.0
        ],
        "quat": [
          0.0,
          0.0,
          0.0,
          1.0
        ],
        "scale": 1.0
      },
      "cover": "none",
      "source": "prefabCoords"
    }
  ]
}
