{
  "schemaVersion": "1.0.0",
  "prefabId": 1387,
  "slug": "NewspaperBooth_E_01_redyellow",
  "resourceName": "Prefabs/Structures/Commercial/Booth/NewspaperBooth_E_01/NewspaperBooth_E_01_redyellow.et",
  "kind": "building",
  "blocks": true,
  "canopy": false,
  "localBounds": {
    "min": [
      -2.2114930152893066,
      -1.059105396270752,
      -2.528928518295288
    ],
    "max": [
      1.9247030019760132,
      3.0385146141052246,
      2.2532923221588135
    ]
  },
  "shellBvh": "blas/BoothNews_E_01.bvh",
  "instances": [
    {
      "id": "NewspaperBooth_E_01_redyellow",
      "kind": "shell",
      "prefab": "Prefabs/Structures/Commercial/Booth/NewspaperBooth_E_01/NewspaperBooth_E_01_redyellow.et",
      "blas": "blas/BoothNews_E_01.bvh",
      "xob": "Assets/Structures/Commercial/Booth/BoothNews_E_01/BoothNews_E_01.xob",
      "local": {
        "pos": [
          0.0,
          0.0,
          0.0
        ],
        "quat": [
          0.0,
          0.0,
          0.0,
          1.0
        ],
        "scale": 1.0
      },
      "cover": "none",
      "source": "prefabCoords"
    },
    {
      "id": "socket_glass_102x58",
      "kind": "glass",
      "prefab": "Prefabs/Structures/BuildingParts/Windows/Glass_102x58/Glass_102x58.et",
      "blas": "blas/Glass_01_102x58.bvh",
      "xob": "Assets/Structures/BuildingsParts/Windows/Glass_102x58/Glass_01_102x58.xob",
      "local": {
        "pos": [
          -0.7069939970970154,
          1.736436367034912,
          2.124277353286743
        ],
        "quat": [
          0.7071067811865475,
          0.7071067811865475,
          0.0,
          0.0
        ],
        "scale": 1.0
      },
      "cover": "none",
      "source": "xobSocket"
    },
    {
      "id": "socket_door_ext_left_01",
      "kind": "doorLeaf",
      "prefab": "Prefabs/Structures/BuildingParts/Doors/Door_Village_E_A_RIGHT_EXT_COV_B.et",
      "blas": "blas/Door_Village_E_A_RIGHT_EXT_COV_B.bvh",
      "xob": "Assets/Structures/BuildingsParts/Doors/Door_Village_E/Door_Village_E_A_RIGHT_EXT_COV_B.xob",
      "local": {
        "pos": [
          -0.25211280584335327,
          0.05000019818544388,
          2.0590600967407227
        ],
        "quat": [
          0.0,
          0.0,
          0.0,
          1.0
        ],
        "scale": 1.0
      },
      "door": {
        "angleRangeDeg": -90.0,
        "closedAngleDeg": 0.0,
        "initialAngleDeg": 0.0,
        "angleRangeExplicit": true
      },
      "cover": "full",
      "source": "xobSocket"
    },
    {
      "id": "socket_glass_138x100_02",
      "kind": "glass",
      "prefab": "Prefabs/Structures/BuildingParts/Windows/Glass_BoothNews_E/Glass_BoothNews_E_138x100.et",
      "blas": "blas/Glass_BloothNews_E_138x100.bvh",
      "xob": "Assets/Structures/BuildingsParts/Windows/Glass_BoothNews_E_138x100/Glass_BloothNews_E_138x100.xob",
      "local": {
        "pos": [
          -1.1267759799957275,
          1.736436367034912,
          1.403444766998291
        ],
        "quat": [
          0.0,
          0.7071067811865474,
          0.0,
          0.7071067811865476
        ],
        "scale": 1.0
      },
      "cover": "none",
      "source": "xobSocket"
    },
    {
      "id": "socket_glass_138x100_01",
      "kind": "glass",
      "prefab": "Prefabs/Structures/BuildingParts/Windows/Glass_BoothNews_E/Glass_BoothNews_E_138x100.et",
      "blas": "blas/Glass_BloothNews_E_138x100.bvh",
      "xob": "Assets/Structures/BuildingsParts/Windows/Glass_BoothNews_E_138x100/Glass_BloothNews_E_138x100.xob",
      "local": {
        "pos": [
          -1.1267759799957275,
          1.730374813079834,
          -1.5606472492218018
        ],
        "quat": [
          0.0,
          0.7071067811865474,
          0.0,
          0.7071067811865476
        ],
        "scale": 1.0
      },
      "cover": "none",
      "source": "xobSocket"
    },
    {
      "id": "socket_glass_135x50_02",
      "kind": "glass",
      "prefab": "Prefabs/Structures/BuildingParts/Windows/Glass_BoothNews_E/Glass_BoothNews_E_135x50.et",
      "blas": "blas/Glass_BloothNews_E_135x50.bvh",
      "xob": "Assets/Structures/BuildingsParts/Windows/Glass_BoothNews_E_135x50/Glass_BloothNews_E_135x50.xob",
      "local": {
        "pos": [
          -0.8240317106246948,
          1.4705125093460083,
          -0.13909479975700378
        ],
        "quat": [
          -0.01049108100512248,
          0.7070289507646371,
          0.01049108100512248,
          0.7070289507646373
        ],
        "scale": 1.0
      },
      "cover": "none",
      "source": "xobSocket"
    },
    {
      "id": "socket_glass_135x50_01",
      "kind": "glass",
      "prefab": "Prefabs/Structures/BuildingParts/Windows/Glass_BoothNews_E/Glass_BoothNews_E_135x50.et",
      "blas": "blas/Glass_BloothNews_E_135x50.bvh",
      "xob": "Assets/Structures/BuildingsParts/Windows/Glass_BoothNews_E_135x50/Glass_BloothNews_E_135x50.xob",
      "local": {
        "pos": [
          -0.8567699193954468,
          1.9737552404403687,
          -0.1394146978855133
        ],
        "quat": [
          0.0,
          0.7071067811865474,
          0.0,
          0.7071067811865476
        ],
        "scale": 1.0
      },
      "cover": "none",
      "source": "xobSocket"
    },
    {
      "id": "socket_glass_113x100",
      "kind": "glass",
      "prefab": "Prefabs/Structures/BuildingParts/Windows/Glass_BoothNews_E/Glass_BoothNews_E_113x100.et",
      "blas": "blas/Glass_BloothNews_E_113x100.bvh",
      "xob": "Assets/Structures/BuildingsParts/Windows/Glass_BoothNews_E_113x100/Glass_BloothNews_E_113x100.xob",
      "local": {
        "pos": [
          -0.4304584860801697,
          1.7208369970321655,
          -2.4171805381774902
        ],
        "quat": [
          0.0,
          0.0,
          0.0,
          1.0
        ],
        "scale": 1.0
      },
      "cover": "none",
      "source": "xobSocket"
    }
  ],
  "notes": [
    "5218A82C34CB36A2: Prefabs/Structures/Core/ProbeHouse_Base.et has no mesh"
  ]
}
